Module,Kind,,seq,Businessterm,Definition,Datatype,ObjectClassTermQualifier,ObjectClassTerm,PropertyTermQualifier,PropertyTerm,DatatypeQualifier,RepresentationTerm,AssociatedObjectClassTermQualifier,AssociatedObjectClass,Occurrence,Additional explanation,日本語訳,説明,追加説明,Example Value (値の例),Rules,Section,BIS extension,UBL syntax xPath,Data Type,Attributes - adjustments,Cardinality,CE 16931-3-1 Table 3 -- Alignment of cardinalities
Billing,ABIE,0,ibg-00,INVOICE,,,,Invoice,,Detail,,,,,0..n,,,,,,,,,,,,,
Billing,IDBIE,1,ibt-001,Invoice number,A unique identification of the Invoice.,Identifier,,Invoice,,Identification,,Identifier,,,1..1,,請求書番号,売り手が発番した請求書を識別する番号または文字列。売り手が発番した、請求書を一意に識別する番号。,,16,ibr-2,Shared,,/Invoice/cbc:ID,IdentifierType,,1..1,
Billing,BBIE,2,ibt-002,Invoice issue date,The date when the Invoice was issued.,Date,,Invoice,,Issue,,Date,,,1..1,The date is described in the Christian era and is YYYY-MM-DD according to the rule PEPPOL-EN16931-F001. ,請求書発行日,請求書の発行日付、または請求書の書面上の発行日付。,日付表示は西暦表示で、ルール PEPPOL-EN16931-F001 に従い、YYYY-MM-DD となる。,37684,ibr-3,Shared,,/Invoice/cbc:IssueDate,DateType,,1..1,
Billing,BBIE,3,ibt-168,Invoice issue time,The time of day when an invoice was issued,Time,,Invoice,,Issue,,Time,,,0..1,,請求書発行時刻,請求書の発行時刻。,,,,Shared,Added,/Invoice/cbc:IssueTime,TimeType,,1..1,CAR-1
Billing,BBIE,4,ibt-003,Invoice type code,A code specifying the functional type of the Invoice.,Code,,Invoice,,Type,,Code,,,1..1,,請求書タイプコード,この文書のタイプを識別するコード。請求書の機能を特定するためのコード。,UNTDID 1001 Peppol BIS Billing 3.0(https://docs.peppol.eu/poacc/billing/3.0/bis/#codelist)では、\n/ ubl:Invoice / cbc:InvoiceTypeCode\n80 Debit note related to goods or services\n82 Metered services invoice\n84 Debit note related to financial adjustments\n380 Commercial invoice\n383 Debit note\n386 Prepayment invoice\n393 Factored invoice\n395 Consignment invoice\n575 Insurer's invoice\n623 Forwarder's invoice\n780 Freight invoice\n/ ubl:CreditNote / cbc:CreditNoteTypeCode\n81 Credit note related to goods or services\n83 Credit note related to financial adjustments\n381 Credit note\n396 Factored credit note\n532 Forwarder's credit note,38 (Commercial Invoice),"ibr-4,ibr-cl-1,jp-cl-1",Shared,,/Invoice/cbc:InvoiceTypeCode,CodeType,,0..1,CAR-2
Billing,BBIE,5,ibt-005,Invoice currency code,"The currency in which all Invoice amounts are given, except for the Total TAX amount in accounting currency.",Code,,Invoice,,Currency,,Code,,,1..1,The currency code must be the one listed in the ISO 4217 Currency codes. ,請求書通貨コード,請求書に記載された通貨を表すコード。会計通貨での請求書消費税合計金額を除き、請求書に記載されている全て金額の表示の通貨コード。,通貨コードは、ISO 4217 Currency codes で定められているものを使用しなければならない。,JPY,"ibr-5,ibr-cl-4",Shared,,/Invoice/cbc:DocumentCurrencyCode,CodeType,,0..1,CAR-2
Billing,BBIE,6,ibt-006,Tax accounting currency,The currency used for TAX accounting and reporting purposes as accepted or required in the country of the Seller.,Code,,Invoice,Tax accounting,Currency,,Code,,,0..1,The currency code must be the one listed in the ISO 4217 Currency codes. ,税会計報告用通貨コード,会計報告や財務報告に使用する通貨を表すコード。売り手の国で認められたもしくは要求された会計報告や財務報告に使用する通貨を表すコード。,通貨コードは、ISO 4217 Currency codes で定められているものを使用しなければならない。,,"ibr-53,ibr-cl-5",Aligned,,/Invoice/cbc:TaxCurrencyCode,CodeType,,0..1,
Billing,BBIE,7,ibt-007,TAX point date,"The date when the TAX becomes accountable for the Seller and for the Buyer in so far as that date can be determined and differs from the date of issue of the invoice, according to the TAX directive.",Date,,Invoice,,Tax point date,,Date,,,0..1,"The date is described in the Christian era and is YYYY-MM-DD according to the rule PEPPOL-EN16931-F001. To present ""date of the transfer of taxable assets, etc"", in case that ""date of the transfer of taxable assets, etc"" is a single date,  ibt-007 tax point date can be used. In case that ""date of the transfer of taxable assets, etc"" is a period, ibg-14 INVOICING PERIOD on document level can be used. ibg-14 defines period during which the goods or services that are invoiced were provided. The main use case is for metered service. As example online data consumption or utililities but it can also be used for goods delivered during a period, as is the case for the summarized invoice. In the same way IBG-26 INVOICE LINE PERIOD on line level can be used when there are different dates for each line.",課税基準日,請求書の日付とは異なる日付が、商取引の課税対象とされる基準日。税法に基づき、請求書発行日付とは異なる日付で、売り手、買い手が税を記帳する場合の、その日付。,日付表示は西暦表示で、ルール PEPPOL-EN16931-F001 に従い、YYYY-MM-DD となる。課税資産の譲渡等の日を表すために、課税資産の譲渡等の日が単一の日付の場合は、ibt-007 課税基準日の日付を使用できる。課税資産の譲渡等の日が期間の場合、ドキュメントレベルの IBG-14 請求期間を使用できる。IBG-14は、請求される商品またはサービスが提供された期間を定義している。主な使用例は、従量制サービスであり、 例としてはオンラインデータの消費あるいは電気ガス水道といった公益料金であるが、合算請求書のケースのように、期間中に提供された商品の場合にも使用できる。同様に、各行ごとに課税資産の譲渡等の日が異なる場合、請求書明細行レベルのIBG-26 請求書明細行の期間を使用できる。,,ibr-co-11,Aligned,,/Invoice/cbc:TaxPointDate,DateType,,0..1,
Billing,BBIE,8,ibt-008,TAX point date code,The code of the date when the TAX becomes accountable for the Seller and for the Buyer.,Code,,Invoice,,Tax point date,,Code,,,0..1,"The TAX point date code must be the one listed in the UNCL2005 subset. \n3 Invoice document issue date time \n35 Delivery date/time, actual\n432 Paid to date",課税基準日コード,売り手、買い手が税を記帳する日付が何であるかを示すコード。,"VAT date code (UNCL2005 subset) から選択する。\n3 Invoice document issue date time (請求書発行日付時刻)\n35 Delivery date/time, actual (実際納入日付時刻)\n432 Paid to date (支払日)",3 (請求書発行日付時刻),,Aligned,,/Invoice/cac:InvoicePeriod/cbc:DescriptionCode,CodeType,,0..n,CAR-3
Billing,BBIE,9,ibt-009,Payment due date,The date when the payment is due.,Date,,Invoice,,Payment due,,Date,,,0..1,The date is described in the Christian era and is YYYY-MM-DD according to the rule PEPPOL-EN16931-F001. ,支払期日,支払条件で示された支払期日。,日付表示は西暦表示で、ルール PEPPOL-EN16931-F001 に従い、YYYY-MM-DD となる。,377,ibr-co-25,Shared,,/Invoice/cbc:DueDate,DateType,,0..1,
Billing,BBIE,10,ibt-010,Buyer reference,An identifier assigned by the Buyer used for internal routing purposes.,Text,,Invoice,Buyer,Reference,,Text,,,0..1,,買い手参照,買い手によって割り当てられたIDで、買い手の内部ルーティングの目的で使用。買い手が付したIDで、買い手内部での後続処理目的で使用。,,,,Shared,,/Invoice/cbc:BuyerReference,TextType,,0..1,
Billing,RFBIE,11,ibt-011,Project reference,The identification of the project the invoice refers to ,Document Reference,,Invoice,,Reference,,,,Project,0..1,,プロジェクト参照,発注品に関するプロジェクト・工事案件等を管理するための番号。インボイスが参照するプロジェクトのID。,,,,Shared,,/Invoice/cac:ProjectReference/cbc:ID,IdentifierType,,1..1,CAR-1
Billing,RFBIE,12,ibt-012,Contract reference,The identification of a contract.,Document Reference,,Invoice,,Reference,,,,Contract,0..1,,契約書参照,参照する契約書に記載の文書番号。,,,,Shared,,/Invoice/cac:ContractDocumentReference/cbc:ID,IdentifierType,,1..1,CAR-1
Billing,RFBIE,13,ibt-013,Purchase order reference,"An identifier of a referenced purchase order, issued by the Buyer.",Document Reference,,Invoice,,Reference,,,,Purchase order,0..1,,購買発注参照,買い手が発行した購買発注を参照する場合の当該購買発注に記載の文書番号。,,AA-123-AA,,Shared,,/Invoice/cac:OrderReference/cbc:ID,IdentifierType,,1..1,CAR-1
Billing,RFBIE,14,ibt-014,Sales order reference,An identifier of a referenced sales order issued by the Seller.,Document Reference,,Invoice,,Reference,,,,Sales order,0..1,,受注参照,売り手が発行した受注を参照する場合の当該受注に記載の文書番号。,,,,Shared,,/Invoice/cac:OrderReference/cbc:SalesOrderID,IdentifierType,,0..1,
Billing,RFBIE,15,ibt-015,Receiving advice reference,An identifier of a referenced receiving advice.,Document Reference,,Invoice,,Reference,,,,Receiving advice,0..1,,受取通知書(検収書)参照,参照する受取通知書（検収書）に売り手が付番した番号。,,,,Shared,,/Invoice/cac:ReceiptDocumentReference/cbc:ID,IdentifierType,,1..1,CAR-1
Billing,RFBIE,16,ibt-016,Despatch advice reference,An identifier of a referenced despatch advice.,Document Reference,,Invoice,,Reference,,,,Despatch advice,0..n,,出荷案内書(納品書)参照,参照する出荷案内書（納品書）に売り手が付番した番号。,,,,Aligned,Cardinality from ..1 to ..n,/Invoice/cac:DespatchDocumentReference/cbc:ID,IdentifierType,,1..1,CAR-4
Billing,RFBIE,17,ibt-017,Tender or lot reference,The identification of the call for tender or lot the invoice relates to.,Document Reference,,Invoice,,Reference,,,,Tender ot lot,0..1,,入札又はロット参照,参照する入札またはロットの番号。,,,,Shared,,/Invoice/cac:OriginatorDocumentReference[not(cbc:DocumentTypeCode='13')]/cbc:ID,IdentifierType,with cbc:DocumentTypeCode != '13',1..1,CAR-1
Billing,BBIE,18,ibt-018,Invoiced object identifier,"An identifier for an object on which the invoice is based, given by the Seller.",Identifier,,Invoice,Invoiced object,Reference,,Identifier,,,0..1,,請求されるオブジェクトID,請求書の根拠となるIDで、売り手が指定。請求書の根拠となるオブジェクトのIDで、売り手が指定したもの。,,,,Shared,,/Invoice/cac:AdditionalDocumentReference[cbc:DocumentTypeCode='13']/cbc:ID,IdentifierType,with cbc:DocumentTypeCode = '13',1..1,CAR-1
Billing,BBIE,19,ibt-019,Buyer accounting reference,A textual value that specifies where to book the relevant data into the Buyer's financial accounts.,Text,,Invoice,,Buyer accounting,,Text,,,0..1,,買い手会計参照,買い手の財務勘定科目に関連データを記帳する場所を指定する。買い手のどの勘定に関連データを記帳すべきかを指定するためのテキスト値。,,,,Shared,,/Invoice/cbc:AccountingCost,TextType,,0..1,
Billing,ASBIE,20,ibg-33,INVOICE TERMS,Information about the terms that apply to the settlement of the invoice amount.,,,Invoice,,Defined,,,,Invoice Terms,0..n,"For further details, see EIPA_SDC_Payment検討.pptx.",支払条件,請求額の決済に適用される条件に関する情報。,詳細については、EIPA_SDC_Payment検討.pptx を参照。 ,,,Aligned,Added as Group,/Invoice/cac:PaymentTerms,PaymentTermsType,,0..n,
Billing,ABIE,0,ibt-020,INVOICE TERMS,A textual description of the payment terms that apply to the amount due for payment (Including description of possible penalties).,,,Invoice Terms,,Detail,,,,,0..1,"Common description in English\nPIA - Payment in advance\nNet 30 - Payment 30 days after invoice date\nEOM - End of month\n21 MFI - 21st of the month following invoice date\n1% 10 Net 30 - 1% discount if payment received within ten days otherwise payment 30 days after invoice date\nCOD - Cash on delivery\n1MD - Monthly credit payment of a full month's supply\netc.\nsource: https://examples.yourdictionary.com/payment-terms-examples.html\nThe information to show ""Who bears bank charge"" can be also putas textual payment terms.",支払条件,支払額に適用される支払条件の説明(罰則の記載を含む)。支払条件の文字による説明。,英語での慣用例文\nPIA - Payment in advance\nNet 30 - Payment 30 days after invoice date\nEOM - End of month\n21 MFI - 21st of the month following invoice date\n1% 10 Net 30 - 1% discount if payment received within ten days otherwise payment 30 days after invoice date\nCOD - Cash on delivery\n1MD - Monthly credit payment of a full month's supply\netc.\nsource: https://examples.yourdictionary.com/payment-terms-examples.html\n振込手数料を売り手買い手のどちらが負担するかといった情報をテキスト情報として入れ込むことは可能である。,,ibr-co-25,Shared,Cardinality to ..n via Group,/Invoice/cac:PaymentTerms/cbc:Note,TextType,,0..n,CAR-3
Billing,BBIE,1,ibt-020,Payment terms,A textual description of the payment terms that apply to the amount due for payment (Including description of possible penalties).,Text,,Invoice Terms,,Payment terms,,Text,,,0..1,"Common description in English\nPIA - Payment in advance\nNet 30 - Payment 30 days after invoice date\nEOM - End of month\n21 MFI - 21st of the month following invoice date\n1% 10 Net 30 - 1% discount if payment received within ten days otherwise payment 30 days after invoice date\nCOD - Cash on delivery\n1MD - Monthly credit payment of a full month's supply\netc.\nsource: https://examples.yourdictionary.com/payment-terms-examples.html\nThe information to show ""Who bears bank charge"" can be also putas textual payment terms.",支払条件,支払額に適用される支払条件の説明(罰則の記載を含む)。支払条件の文字による説明。,英語での慣用例文\nPIA - Payment in advance\nNet 30 - Payment 30 days after invoice date\nEOM - End of month\n21 MFI - 21st of the month following invoice date\n1% 10 Net 30 - 1% discount if payment received within ten days otherwise payment 30 days after invoice date\nCOD - Cash on delivery\n1MD - Monthly credit payment of a full month's supply\netc.\nsource: https://examples.yourdictionary.com/payment-terms-examples.html\n振込手数料を売り手買い手のどちらが負担するかといった情報をテキスト情報として入れ込むことは可能である。,,ibr-co-25,Shared,Cardinality to ..n via Group,/Invoice/cac:PaymentTerms/cbc:Note,TextType,,0..n,CAR-3
Billing,IDBIE,2,ibt-187,Terms payment instructions ID,The payment instructions that apply to these payment terms.,Identifier,,Invoice Terms,,Identification,,Identifier,,,0..1,,支払条件指示ID,これらの支払条件を適用する支払指示。,,,,Aligned,Added,/Invoice/cac:PaymentTerms/cbc:PaymentMeansID,IdentifierType,,0..n,CAR-3
Billing,BBIE,3,ibt-176,Terms amount,The payment amount that these terms apply to.,Amount,,Invoice Terms,,Terms amount,,Amount,,,0..1,"In the numerical representation, for data type amount, only the integer is allowed and the integer part is not separated by 1000 units.",支払条件金額,これらの条件が適用される支払金額。,数値表現は、データ型 Amount については、整数、整数部分の1000単位の区切りはなし。,,,Aligned,Added,/Invoice/cac:PaymentTerms/cbc:Amount,AmountType,,0..1,
Billing,BBIE,4,ibt-177,Terms installment due date,The date before end of which the terms amount shall be settled.,Date,,Invoice Terms,,Terms installment due date,,Date,,,0..1,The date is described in the Christian era and is YYYY-MM-DD according to the rule PEPPOL-EN16931-F001. ,分割支払支払期日,分割支払の場合の各支払期日。,日付表示は西暦表示で、ルール PEPPOL-EN16931-F001 に従い、YYYY-MM-DD となる。,,,Aligned,Added,/Invoice/cac:PaymentTerms/cbc:InstallmentDueDate,DateType,,0..1,
Billing,ASBIE,21,ibg-01,INVOICE NOTE,"A group of business terms providing textual notes that are relevant for the invoice, together with an indication of the note subject.",,,Invoice,,Defined,,,,Invoice Note,0..n,,請求書注釈,請求書についての注釈。,,,,,,,,,,
Billing,ABIE,0,ibg-01,INVOICE NOTE,"A group of business terms providing textual notes that are relevant for the invoice, together with an indication of the note subject.",,,Invoice Note,,Detail,,,,,0..n,,請求書注釈,請求書についての注釈。,,,,,,,,,,
Billing,BBIE,1,ibt-021,Invoice note subject code,The subject of the textual note in EN BT-22.,Text,,Invoice Note,,Subject,,Code,,,0..1,,請求書注釈表題コード,注釈の表題。,,,,Shared,,/Invoice/cbc:Note,TextType,"Use #subjectcode# 
Code list UNTDID 4451",0..n,CAR-3
Billing,BBIE,2,ibt-022,Invoice note,A textual note that gives unstructured information that is relevant to the Invoice as a whole.,Text,,Invoice Note,,Note,,Text,,,0..1,,請求書注釈内容,注釈の内容を入力するフリースペース。,,,,Shared,,/Invoice/cbc:Note,TextType,,0..n,CAR-3
Billing,ASBIE,22,ibg-02,PROCESS CONTROL,A group of business terms providing information on the business process and rules applicable to the Invoice document.,,,Invoice,,Defined,,,,Process Control,1..1,,プロセスコントロール,取引プロセスに関する情報。請求書に適用するビジネスプロセス及びルールについての情報。,,,,,,,,,,
Billing,ABIE,0,ibg-02,PROCESS CONTROL,A group of business terms providing information on the business process and rules applicable to the Invoice document.,,,Process Control,,Detail,,,,,1..1,,プロセスコントロール,取引プロセスに関する情報。請求書に適用するビジネスプロセス及びルールについての情報。,,,,,,,,,,
Billing,BBIE,1,ibt-023,Business process type (Profile ID),"Identifies the business process context in which the transaction appears, to enable the Buyer to process the Invoice in an appropriate way.",Text,,Process Control,,Business process type,,Text,,,0..1,"Standard japanese Invoice BIS (equal to the Peppol BIS Billing)\nProfile ID: urn:peppol:bis:billing\nInvoice Customization ID: urn:peppol:pint:billing-3.0@jp:peppol-1\n\n
Standard japanese Debit Note BIS\nProfile ID: urn:peppol:bis:debitnote\nDebit Note Customization ID: urn:peppol:pint:debitnote-3.0@jp:peppol-1\n\nJapanese Summary Invoice, pattern 1 BIS (Process contains Invoice transactions with additional rules)\nProfile ID: urn:peppol:bis:billing\nInvoice Customization ID: urn:peppol:pint:billing-3.0@jp:peppol-1@jp:suminvpt1-2",ビジネスプロセスタイプ  (Profile ID),取引プロセスの名称。買い手が適切な方法で請求書を処理することができるように、取引が行われたビジネスプロセスを識別する。,"都度請求書 (Peppol BIS Billingと同じ)\nProfile ID: urn:peppol:bis:billing\nInvoice Customization ID: urn:peppol:pint:billing-3.0@jp:peppol-1\n\n
納品書\nProfile ID: urn:peppol:bis:debitnote\nDebit Note Customization ID: urn:peppol:pint:debitnote-3.0@jp:peppol-1\n\n合算請求書パターン１ (業務手順に追加条件あり)\nProfile ID: urn:peppol:bis:billing\nInvoice Customization ID: urn:peppol:pint:billing-3.0@jp:peppol-1@jp:suminvpt1-2",urn:fdc:peppol.eu:217:poacc:billing:1:1.,,Shared,,/Invoice/cbc:ProfileID,IdentifierType,,0..1,
Billing,BBIE,2,ibt-024,Specification identifier (Customization ID),"An identification of the specification containing the total set of rules regarding semantic content, cardinalities and business rules to which the data contained in the instance document conforms.",Identifier,,Process Control,,Specification,,Identifier,,,1..1,"Standard japanese Invoice BIS (equal to the Peppol BIS Billing)\nProfile ID: urn:peppol:bis:billing\nInvoice Customization ID: urn:peppol:pint:billing-3.0@jp:peppol-1\n\n
Standard japanese Debit Note BIS\nProfile ID: urn:peppol:bis:debitnote\nDebit Note Customization ID: urn:peppol:pint:debitnote-3.0@jp:peppol-1\n\nJapanese Summary Invoice, pattern 1 BIS (Process contains Invoice transactions with additional rules)\nProfile ID: urn:peppol:bis:billing\nInvoice Customization ID: urn:peppol:pint:billing-3.0@jp:peppol-1@jp:suminvpt1-1",仕様ID (Customization ID),取引プロセスのID。セマンティックコンテンツ、カーディナリティや、インスタンス文書に含まれているデータが準拠すべきビジネスルールに関するルール一式を含む、仕様を識別する。,"都度請求書 (Peppol BIS Billingと同じ)\nProfile ID: urn:peppol:bis:billing\nInvoice Customization ID: urn:peppol:pint:billing-3.0@jp:peppol-1\n\n
納品書\nProfile ID: urn:peppol:bis:debitnote\nDebit Note Customization ID: urn:peppol:pint:debitnote-3.0@jp:peppol-1\n\n合算請求書パターン１ (業務手順に追加条件あり)\nProfile ID: urn:peppol:bis:billing\nInvoice Customization ID: urn:peppol:pint:billing-3.0@jp:peppol-1@jp:suminvpt1-1",urn:cen.eu:en16931:217#compliant#urn:fdc:peppol.eu:217:poacc:billing:3.,ibr-1,Shared,,/Invoice/cbc:CustomizationID,IdentifierType,,0..1,CAR-2
Billing,ASBIE,23,ibg-03,PRECEDING INVOICE REFERENCE,A group of business terms providing information on one or more preceding Invoices.,,,Invoice,,Defined,,,,Preceding Invoice Reference,0..n,,先行請求書への参照,1つ以上の先行請求書に関する情報。\n,,,ibr-55,,,/Invoice/cac:BillingReference,BillingReferenceType,,0..n,
Billing,ABIE,0,ibg-03,PRECEDING INVOICE REFERENCE,A group of business terms providing information on one or more preceding Invoices.,,,Preceding Invoice Reference,,Detail,,,,,0..n,,先行請求書への参照,1つ以上の先行請求書に関する情報。\n,,,ibr-55,,,/Invoice/cac:BillingReference,BillingReferenceType,,0..n,
Billing,RFBIE,1,ibt-025,Preceding Invoice reference,The identification of an Invoice that was previously sent by the Seller.,Document Reference,,Preceding Invoice Reference,Preceding,Reference,,,,Invoice,1..1,,先行請求書への参照,売り手が以前に送付した請求書番号。,,,ibr-55,Shared,,/Invoice/cac:BillingReference/cac:InvoiceDocumentReference/cbc:ID,IdentifierType,,1..1,
Billing,BBIE,2,ibt-026,Preceding Invoice issue date,The date when the Preceding Invoice was issued.,Date,,Preceding Invoice Reference,Referencing,Invoice,,Date,,,0..1,The date is described in the Christian era and is YYYY-MM-DD according to the rule PEPPOL-EN16931-F001. ,先行請求書発行日,先行請求書の発行日。,日付表示は西暦表示で、ルール PEPPOL-EN16931-F001 に従い、YYYY-MM-DD となる。,,,Shared,,/Invoice/cac:BillingReference/cac:InvoiceDocumentReference/cbc:IssueDate,DateType,,0..1,
Billing,ASBIE,24,ibg-04,SELLER,A group of business terms providing information about the Seller.,,,Invoice,,Defined,,,,Seller,1..1,,売り手,売り手に係る情報。,,,"ibr-17,ibr-18,ibr-19,ibr-2",,,/Invoice/cac:AccountingSupplierParty,SupplierPartyType,,1..1,
Billing,ABIE,0,ibg-04,SELLER,A group of business terms providing information about the Seller.,,,Seller,,Detail,,,,,1..1,,売り手,売り手に係る情報。,,,"ibr-17,ibr-18,ibr-19,ibr-2",,,/Invoice/cac:AccountingSupplierParty,SupplierPartyType,,1..1,
Billing,BBIE,1,ibt-027,Seller name,The full formal name by which the Seller is registered in the national registry of legal entities or as a Taxable person or otherwise trades as a person or persons.,Text,,Seller,,Name,,Text,,,1..1,,売り手名称,売り手を表す名称。売り手を表す法的に正式な名称。,,株式会社 ○○商事,ibr-6,Shared,,/Invoice/cac:AccountingSupplierParty/cac:Party/cac:PartyLegalEntity/cbc:RegistrationName,NameType,,0..1,CAR-2
Billing,BBIE,2,ibt-028,Seller trading name,"A name by which the Seller is known, other than Seller name (also known as Business name).",Text,,Seller,,Trading name,,Text,,,0..1,,売り手商号,売り手名称以外で、知られているビジネス上の名称。,,株式会社 ○○商事,,Shared,,/Invoice/cac:AccountingSupplierParty/cac:Party/cac:PartyName/cbc:Name,NameType,,1..1,CAR-1
