Module,Kind,,seq,Businessterm,Definition,Datatype,ObjectClassTermQualifier,ObjectClassTerm,PropertyTermQualifier,PropertyTerm,DatatypeQualifier,RepresentationTerm,AssociatedObjectClassTermQualifier,AssociatedObjectClass,Occurrence,Additional explanation,日本語訳,説明,追加説明,Example Value (値の例),Rules,Section,BIS extension,UBL syntax xPath,Data Type,Attributes - adjustments,Cardinality,CE 16931-3-1 Table 3 -- Alignment of cardinalities
Billing,BBIE,1,ibt-064,Tax representative address line 1,The main address line in an address. ,Text,Seller Tax Representative,Postal Address,,Line 1,,Text,,,0..1,,納税管理人住所欄1,納税管理人住所欄1。,,,,Shared,,/Invoice/cac:TaxRepresentativeParty/cac:PostalAddress/cbc:StreetName,NameType,,0..1,
Billing,BBIE,2,ibt-065,Tax representative address line 2,An additional address line in an address that can be used to give further details supplementing the main line.,Text,Seller Tax Representative,Postal Address,,Line 2,,Text,,,0..1,,納税管理人住所欄2,納税管理人住所欄2。,,,,Shared,,/Invoice/cac:TaxRepresentativeParty/cac:PostalAddress/cbc:AdditionalStreetName,NameType,,0..1,
Billing,BBIE,3,ibt-164,Tax representative address line 3,An additional address line in an address that can be used to give further details supplementing the main line.,Text,Seller Tax Representative,Postal Address,,Line 3,,Text,,,0..1,,納税管理人住所欄3,納税管理人住所欄3。,,,,Shared,,/Invoice/cac:TaxRepresentativeParty/cac:PostalAddress/cac:AddressLine/cbc:Line,TextType,,1..1,CAR-1
Billing,BBIE,4,ibt-066,Tax representative city,"The common name of the city, town or village, where the tax representative address is located.",Text,Seller Tax Representative,Postal Address,,City,,Text,,,0..1,,納税管理人住所 市区町村,納税管理人住所 市区町村。,,,,Shared,,/Invoice/cac:TaxRepresentativeParty/cac:PostalAddress/cbc:CityName,NameType,,0..1,
Billing,BBIE,5,ibt-067,Tax representative post code,The identifier for an addressable group of properties according to the relevant postal service.,Text,Seller Tax Representative,Postal Address,,Post code,,Text,,,0..1,,納税管理人郵便番号,納税管理人郵便番号。,,,,Shared,,/Invoice/cac:TaxRepresentativeParty/cac:PostalAddress/cbc:PostalZone,TextType,,0..1,
Billing,BBIE,6,ibt-068,Tax representative country subdivision,The subdivision of a country. ,Text,Seller Tax Representative,Postal Address,,Country subdivision,,Text,,,0..1,,納税管理人住所 都道府県,納税管理人住所の地方区分。日本の場合は、都道府県。,,,,Shared,,/Invoice/cac:TaxRepresentativeParty/cac:PostalAddress/cbc:CountrySubentity,TextType,,0..1,
Billing,BBIE,7,ibt-069,Tax representative country code,A code that identifies the country.,Code,Seller Tax Representative,Postal Address,,Country,,Code,,,1..1,,納税管理人国コード,納税管理人国コード。,,,ibr-2,Shared,,/Invoice/cac:TaxRepresentativeParty/cac:PostalAddress/cac:Country/cbc:IdentificationCode,CodeType,,0..1,CAR-2
Billing,ASBIE,28,ibg-13,DELIVERY INFORMATION,A group of business terms providing information about where and when the goods and services invoiced are delivered.,,,Invoice,,Defined,,,,Delivery Information,0..1,,納入先,納入先に係る情報。,合算請求書には複数の納入先が含まれることがあるので明細行レベルで 0..n,,,,,/Invoice/cac:Delivery,DeliveryType,,0..n,CAR-3
Billing,ABIE,0,ibg-13,DELIVERY INFORMATION,A group of business terms providing information about where and when the goods and services invoiced are delivered.,,,Delivery Information,,Detail,,,,,0..1,,納入先,納入先に係る情報。,合算請求書には複数の納入先が含まれることがあるので明細行レベルで 0..n,,,,,/Invoice/cac:Delivery,DeliveryType,,0..n,CAR-3
Billing,BBIE,1,ibt-070,Deliver to party name,The name of the party to which the goods and services are delivered.,Text,,Delivery Information,,Deliver to party name,,Text,,,0..1,,納入先名称,納入先の名称。,,株式会社 藤山物産 札幌支社,,Shared,,/Invoice/cac:Delivery/cac:DeliveryParty/cac:PartyName/cbc:Name,NameType,,1..1,CAR-1
Billing,IDBIE,2,ibt-071,Deliver to location identifier,An identifier for the location at which the goods and services are delivered.,Identifier,,Delivery Information,,Identification,,Identifier,,,0..1,,納入先ID,納入先の場所ID。,,,ibr-cl-26,Shared,,/Invoice/cac:Delivery/cac:DeliveryLocation/cbc:ID,IdentifierType,,0..1,
Billing,BBIE,3,ibt-072,Actual delivery date,the date on which the supply of goods or services was made or completed.,Date,,Delivery Information,,Actual delivery date,,Date,,,0..1,The date is described in the Christian era and is YYYY-MM-DD according to the rule PEPPOL-EN16931-F001. ,実際納入日,実際の納入日。,日付表示は西暦表示で、ルール PEPPOL-EN16931-F001 に従い、YYYY-MM-DD となる。,44259,,Shared,,/Invoice/cac:Delivery/cbc:ActualDeliveryDate,PeriodType,,0..n,CAR-3
Billing,ASBIE,4,ibg-14,INVOICING PERIOD,A group of business terms providing information on the invoice period.,,,Delivery Information,,Defined,,,Invoicing,Period,0..1,"To present ""date of the transfer of taxable assets, etc"", in case that ""date of the transfer of taxable assets, etc"" is a single date,  ibt-007 tax point date can be used. In case that ""date of the transfer of taxable assets, etc"" is a period, ibg-14 INVOICING PERIOD on document level can be used. ibg-14 defines period during which the goods or services that are invoiced were provided. The main use case is for metered service. As example online data consumption or utililities but it can also be used for goods delivered during a period, as is the case for the summarized invoice. In the same way IBG-26 INVOICE LINE PERIOD on line level can be used when there are different dates for each line.",請求期間,請求期間に関わる情報。,課税資産の譲渡等の日を表すために、課税資産の譲渡等の日が単一の日付の場合は、ibt-007 課税基準日の日付を使用できる。課税資産の譲渡等の日が期間の場合、ドキュメントレベルの IBG-14 請求期間を使用できる。IBG-14は、請求される商品またはサービスが提供された期間を定義している。主な使用例は、従量制サービスであり、 例としてはオンラインデータの消費あるいは電気ガス水道といった公益料金であるが、合算請求書のケースのように、期間中に提供された商品の場合にも使用できる。同様に、各行ごとに課税資産の譲渡等の日が異なる場合、請求書明細行レベルのIBG-26 請求書明細行の期間を使用できる。,,ibr-co-19,,,/Invoice/cac:InvoicePeriod,DateType,,0..1,
Billing,ABIE,0,ibg-14,INVOICING PERIOD,A group of business terms providing information on the invoice period.,,Invoicing,Period,,Detail,,,,,0..1,"To present ""date of the transfer of taxable assets, etc"", in case that ""date of the transfer of taxable assets, etc"" is a single date,  ibt-007 tax point date can be used. In case that ""date of the transfer of taxable assets, etc"" is a period, ibg-14 INVOICING PERIOD on document level can be used. ibg-14 defines period during which the goods or services that are invoiced were provided. The main use case is for metered service. As example online data consumption or utililities but it can also be used for goods delivered during a period, as is the case for the summarized invoice. In the same way IBG-26 INVOICE LINE PERIOD on line level can be used when there are different dates for each line.",請求期間,請求期間に関わる情報。,課税資産の譲渡等の日を表すために、課税資産の譲渡等の日が単一の日付の場合は、ibt-007 課税基準日の日付を使用できる。課税資産の譲渡等の日が期間の場合、ドキュメントレベルの IBG-14 請求期間を使用できる。IBG-14は、請求される商品またはサービスが提供された期間を定義している。主な使用例は、従量制サービスであり、 例としてはオンラインデータの消費あるいは電気ガス水道といった公益料金であるが、合算請求書のケースのように、期間中に提供された商品の場合にも使用できる。同様に、各行ごとに課税資産の譲渡等の日が異なる場合、請求書明細行レベルのIBG-26 請求書明細行の期間を使用できる。,,ibr-co-19,,,/Invoice/cac:InvoicePeriod,DateType,,0..1,
Billing,BBIE,1,ibt-073,Invoicing period start date,The date when the Invoice period starts.,Date,Invoicing,Period,,Start date,,Date,,,0..1,The date is described in the Christian era and is YYYY-MM-DD according to the rule PEPPOL-EN16931-F001. ,請求期間開始日,請求期間開始日。,日付表示は西暦表示で、ルール PEPPOL-EN16931-F001 に従い、YYYY-MM-DD となる。,,"ibr-29,ibr-co-19",Shared,,/Invoice/cac:InvoicePeriod/cbc:StartDate,DateType,,0..1,
Billing,BBIE,2,ibt-074,Invoicing period end date,The date when the Invoice period ends.,Date,Invoicing,Period,,ebd data,,Date,,,0..1,The date is described in the Christian era and is YYYY-MM-DD according to the rule PEPPOL-EN16931-F001. ,請求期間終了日,請求期間終了日。,日付表示は西暦表示で、ルール PEPPOL-EN16931-F001 に従い、YYYY-MM-DD となる。,,"ibr-29,ibr-co-19",Shared,,/Invoice/cac:InvoicePeriod/cbc:EndDate,DateType,,0..1,
Billing,ASBIE,5,ibg-15,DELIVER TO ADDRESS,A group of business terms providing information about the address to which goods and services invoiced were or are delivered.,,,Delivery Information,,Defined,,,Deliver to,Postal Address,0..1,,納入先住所,請求される財/サービスの納入先の住所に関する情報,,,ibr-57,,,/Invoice/cac:Delivery/cac:DeliveryLocation/cac:Address,AddressType,,0..1,
Billing,ABIE,0,ibg-15,DELIVER TO ADDRESS,A group of business terms providing information about the address to which goods and services invoiced were or are delivered.,,Drliver To,Postal Address,,Detail,,,,,0..1,,納入先住所,請求される財/サービスの納入先の住所に関する情報,,,ibr-57,,,/Invoice/cac:Delivery/cac:DeliveryLocation/cac:Address,AddressType,,0..1,
Billing,BBIE,1,ibt-075,Deliver to address line 1,The main address line in an address. ,Text,Drliver To,Postal Address,,Line 1,,Text,,,0..1,,納入先住所欄1,納入先の住所欄1。,,北海道札幌市北区,,Shared,,/Invoice/cac:Delivery/cac:DeliveryLocation/cac:Address/cbc:StreetName,NameType,,0..1,
Billing,BBIE,2,ibt-076,Deliver to address line 2,An additional address line in an address that can be used to give further details supplementing the main line.,Text,Drliver To,Postal Address,,Line 2,,Text,,,0..1,,納入先住所欄2,納入先の住所欄2。,,北十二条西76-X,,Shared,,/Invoice/cac:Delivery/cac:DeliveryLocation/cac:Address/cbc:AdditionalStreetName,NameType,,0..1,
Billing,BBIE,3,ibt-165,Deliver to address line 3,An additional address line in an address that can be used to give further details supplementing the main line.,Text,Drliver To,Postal Address,,Line 3,,Text,,,0..1,,納入先住所欄3,納入先の住所欄3。,,,,Shared,,/Invoice/cac:Delivery/cac:DeliveryLocation/cac:Address/cac:AddressLine/cbc:Line,TextType,,1..1,CAR-1
Billing,BBIE,4,ibt-077,Deliver to city,"The common name of the city, town or village, where the deliver to address is located.",Text,Drliver To,Postal Address,,City,,Text,,,0..1,,納入先住所 市区町村,納入先住所 市区町村。,,北海道札幌市,,Shared,,/Invoice/cac:Delivery/cac:DeliveryLocation/cac:Address/cbc:CityName,NameType,,0..1,
Billing,BBIE,5,ibt-078,Deliver to post code,The identifier for an addressable group of properties according to the relevant postal service.,Text,Drliver To,Postal Address,,Post code,,Text,,,0..1,,納入先郵便番号,納入先の郵便番号。,,1月12日,,Shared,,/Invoice/cac:Delivery/cac:DeliveryLocation/cac:Address/cbc:PostalZone,TextType,,0..1,
Billing,BBIE,6,ibt-079,Deliver to country subdivision,The subdivision of a country. ,Text,Drliver To,Postal Address,,Country subdivision,,Text,,,0..1,,納入先住所 都道府県,納入先住所の地方区分。日本の場合は、都道府県。,,,,Shared,,/Invoice/cac:Delivery/cac:DeliveryLocation/cac:Address/cbc:CountrySubentity,TextType,,0..1,
Billing,BBIE,7,ibt-080,Deliver to country code,A code that identifies the country.,Code,Drliver To,Postal Address,,Country,,Code,,,1..1,,納入先国コード,納入先の国コード。,,JP,ibr-57,Shared,,/Invoice/cac:Delivery/cac:DeliveryLocation/cac:Address/cac:Country/cbc:IdentificationCode,CodeType,,0..1,CAR-2
Billing,ASBIE,29,ibg-16,PAYMENT INSTRUCTIONS,A group of business terms providing information about the payment. ,,,Invoice,,Defined,,,,Payment Instructions,0..n,"For further details, see EIPA_SDC_Payment検討.pptx.",支払指示,取引条件のうち支払に関する情報。,詳細については、EIPA_SDC_Payment検討.pptx を参照。,,ibr-49,,Cardinality from ..1 to ..n,/Invoice/cac:PaymentMeans,PaymentMeansType,,0..n,
Billing,ABIE,0,ibg-16,PAYMENT INSTRUCTIONS,A group of business terms providing information about the payment. ,,,Payment Instructions,,Detail,,,,,0..n,"For further details, see EIPA_SDC_Payment検討.pptx.",支払指示,取引条件のうち支払に関する情報。,詳細については、EIPA_SDC_Payment検討.pptx を参照。,,ibr-49,,Cardinality from ..1 to ..n,/Invoice/cac:PaymentMeans,PaymentMeansType,,0..n,
Billing,IDBIE,1,ibt-178,Payment Instructions ID,An identifier for the payment instructions.,Identifier,,Payment Instructions,,identification,,Identifier,,,0..1,,支払指示ID,各支払指示に対して割り当てられるID。,,,,Aligned,Added,/Invoice/cac:PaymentMeans/cbc:ID,IdentifierType,,0..1,
Billing,BBIE,2,ibt-081,Payment means type code,"The means, expressed as code, for how a payment is expected to be or has been settled.",Code,,Payment Instructions,,Means type code,,Code,,,1..1,,支払手段タイプコード,取引決済手段のタイプを識別するコード。,,3,"ibr-49,ibr-cl-16,jp-cl-2",Aligned,,/Invoice/cac:PaymentMeans/cbc:PaymentMeansCode,CodeType,,1..1,
Billing,BBIE,3,ibt-082,Payment means text,"The means, expressed as text, for how a payment is expected to be or has been settled.",Text,,Payment Instructions,,Means text,,Text,,,0..1,,支払手段内容説明,取引決済手段を説明するテキスト。,,Credit transfer,,Shared,,/Invoice/cac:PaymentMeans/cbc:PaymentMeansCode/@Name,,,,
Billing,BBIE,4,ibt-083,Remittance information,A textual value used for payment routing or to establish a link between the payment and the Invoice.,Text,,Payment Instructions,,Remittance information,,Text,,,0..n,,送金情報,支払と請求書とを紐づけるために使用されるテキスト。,,Snippet1,,Aligned,Cardinality from ..1 to ..n. Definition extended.,/Invoice/cac:PaymentMeans/cbc:PaymentID,IdentifierType,,0..n,
Billing,ASBIE,5,ibg-17,CREDIT TRANSFER,A group of business terms to specify credit transfer payments. ,,,Payment Instructions,,Defined,,,,Credit Transfer,0..n,"For further details, see EIPA_SDC_Payment検討.pptx.",銀行振込,銀行振込による支払を指定。,詳細については、EIPA_SDC_Payment検討.pptx を参照。,,,,,/Invoice/cac:PaymentMeans/cac:PayeeFinancialAccount,FinancialAccountType,,0..1,CAR-4
Billing,ABIE,0,ibg-17,CREDIT TRANSFER,A group of business terms to specify credit transfer payments. ,,,Credit Transfer,,Detail,,,,,0..n,"For further details, see EIPA_SDC_Payment検討.pptx.",銀行振込,銀行振込による支払を指定。,詳細については、EIPA_SDC_Payment検討.pptx を参照。,,,,,/Invoice/cac:PaymentMeans/cac:PayeeFinancialAccount,FinancialAccountType,,0..1,CAR-4
Billing,IDBIE,1,ibt-084,Payment account identifier,"A unique identifier of the financial payment account, at a payment service provider, to which payment should be made.",Identifier,,Credit Transfer,,Identification,,Identifier,,,1..1,"As operation in Japan, a value is filled in ibt-084 Payment account identifier in the following way.Bank code (4 digit):Bank branch code (3 digit):Bank account number (7 digit):Bank account type (1 digit)If no value is filled in ibt-084-1 and only ibt-084 has the string of ""(4 digit):(3 digit):(7 digit):(1 digit)"", that string is interpreted as Bank code (4 digit):Bank branch code (3 digit):Bank account number (7 digit):Bank account type (1 digit).If IBAN is filled in ibt-084-1, the string set in ibt-084 Payment account identifier is interpreted as a code of IBAN. ",支払先口座ID,支払先となる、金融機関の口座ID。IBAN(SEPA支払いの場合)など。,"日本における運用としては、支払先口座IDに、以下のように値をセットすることとする。銀行コード(4桁):支店コード(3桁):口座番号(7桁):口座種別(1桁)ibt-084-1に何もセットされておらず、ibt-084 支払先口座ID に ""4桁:3桁:7桁:1桁"" の文字列がセットされているだけの場合は、この文字列は、銀行コード(4桁):支店コード(3桁):口座番号(7桁):口座種別(1桁) と解釈する。ibt-084-1に IBAN とセットされていたら、ibt-084 支払先口座ID にセットされている文字列は、IBAN のコードであると解釈する。",1234:12:1:123456789,,Shared,,/Invoice/cac:PaymentMeans/cac:PayeeFinancialAccount/cbc:ID,IdentifierType,,0..1,CAR-2
Billing,BBIE,2,ibt-085,Payment account name,"The name of the payment account, at a payment service provider, to which payment should be made.",Text,,Credit Transfer,,Payment account name,,Text,,,0..1,,支払先口座名義人名,支払先口座の口座名義人名。,,株式会社 ○○商事,,Shared,,/Invoice/cac:PaymentMeans/cac:PayeeFinancialAccount/cbc:Name,NameType,,0..1,
Billing,IDBIE,3,ibt-086,Payment service provider identifier,An identifier for the payment service provider where a payment account is located.,Identifier,,Credit Transfer,,Identification,,Identifier,,,0..1,"For example, it is expected to set BIC code (SWIFT code),  however, Japan utilizes ibt-084 Payment account identifier to specify bank code, bank branch code, bank account number, and bank account type. ibt-086 Payment service provider identifier is not used.",支払先金融機関ID,支払先口座がある金融機関ID。,例えば、BICコード(SWIFTコード)をセットすることが想定されているが、日本における運用としては、ibt-084 で支払先口座を指定する運用とするため、この項目は使用しない。,,,Shared,,/Invoice/cac:PaymentMeans/cac:PayeeFinancialAccount/cac:FinancialInstitutionBranch/cbc:ID,IdentifierType,,0..1,
Billing,ASBIE,4,ibg-34,ADDRESS,The address of the financial institution or its branch that holds the payment account.,,,Credit Transfer,,Defined,,,Account,Postal Address,0..1,,住所,金融機関やその支店の住所。,,,,,Added,/Invoice/cac:PaymentMeans/cac:PayeeFinancialAccount/cac:FinancialInstitutionBranch/cac:Address,AddressType,,0..1,
Billing,ABIE,0,ibg-34,ADDRESS,The address of the financial institution or its branch that holds the payment account.,,Account,Postal Address,,Detail,,,,,0..1,,住所,金融機関やその支店の住所。,,,,,Added,/Invoice/cac:PaymentMeans/cac:PayeeFinancialAccount/cac:FinancialInstitutionBranch/cac:Address,AddressType,,0..1,
Billing,BBIE,1,ibt-169,Account address line 1,The main address line in an address. ,Text,Account,Postal Address,,Line 1,,Text,,,0..1,,支払先口座住所欄1,住所欄1。,,,,Aligned,Added,/Invoice/cac:PaymentMeans/cac:PayeeFinancialAccount/cac:FinancialInstitutionBranch/cac:Address/cbc:StreetName,NameType,,0..1,
Billing,BBIE,2,ibt-170,Account address line 2,An additional address line in an address that can be used to give further details supplementing the main line.,Text,Account,Postal Address,,Line 2,,Text,,,0..1,,支払先口座住所欄2,住所欄2。,,,,Aligned,Added,/Invoice/cac:PaymentMeans/cac:PayeeFinancialAccount/cac:FinancialInstitutionBranch/cac:Address/cbc:AdditionalStreetName,NameType,,0..1,
Billing,BBIE,3,ibt-171,Account city,"The common name of the city, town or village, where the account address is located.",Text,Account,Postal Address,,Line 3,,Text,,,0..1,,支払先口座住所 市区町村,支払先口座住所 市区町村。,,,,Aligned,Added,/Invoice/cac:PaymentMeans/cac:PayeeFinancialAccount/cac:FinancialInstitutionBranch/cac:Address/cbc:CityName,NameType,,0..1,
Billing,BBIE,4,ibt-172,Account post code,The identifier for an addressable group of properties according to the relevant postal service.,Text,Account,Postal Address,,City,,Text,,,0..1,,支払先口座郵便番号,支払先口座郵便番号。,,,,Aligned,Added,/Invoice/cac:PaymentMeans/cac:PayeeFinancialAccount/cac:FinancialInstitutionBranch/cac:Address/cbc:PostalZone,TextType,,0..1,
Billing,BBIE,5,ibt-173,Account country subdivision,The subdivision of a country. ,Text,Account,Postal Address,,Post code,,Text,,,0..1,,支払先口座住所 都道府県,支払先口座住所の地方区分。日本の場合は、都道府県。,,,,Aligned,Added,/Invoice/cac:PaymentMeans/cac:PayeeFinancialAccount/cac:FinancialInstitutionBranch/cac:Address/cbc:CountrySubentity,TextType,,0..1,
Billing,BBIE,6,ibt-174,Account address line 3,An additional address line in an address that can be used to give further details supplementing the main line.,Text,Account,Postal Address,,Country subdivision,,Text,,,0..1,,支払先口座住所欄3,住所欄3。,,,,Aligned,Added,/Invoice/cac:PaymentMeans/cac:PayeeFinancialAccount/cac:FinancialInstitutionBranch/cac:Address/cac:AddressLine/cbc:Line,,,,
Billing,BBIE,7,ibt-175,Account country code,A code that identifies the country.,Code,Account,Postal Address,,Country,,Code,,,0..1,,支払先口座国コード,支払先口座国コード。,,,,Aligned,Added,/Invoice/cac:PaymentMeans/cac:PayeeFinancialAccount/cac:FinancialInstitutionBranch/cac:Address/cac:Country/cbc:IdentificationCode,CodeType,,,
Billing,ASBIE,6,ibg-18,PAYMENT CARD INFORMATION,A group of business terms providing information about card used for payment contemporaneous with invoice issuance.,,,Payment Instructions,,Defined,,,,Payment Card Information,0..1,"For further details, see EIPA_SDC_Payment検討.pptx.",支払カード情報,請求書発行と同時に支払に使用されるカードに関する情報。買い手がクレジットカードやデビットカードなどの支払いカードを使用することを選択した場合にのみ使用。,詳細については、EIPA_SDC_Payment検討.pptx を参照。,,,,,/Invoice/cac:PaymentMeans/cac:CardAccount,CardAccountType,,0..1,
Billing,ABIE,0,ibg-18,PAYMENT CARD INFORMATION,A group of business terms providing information about card used for payment contemporaneous with invoice issuance.,,,Payment Card Information,,Detail,,,,,0..1,"For further details, see EIPA_SDC_Payment検討.pptx.",支払カード情報,請求書発行と同時に支払に使用されるカードに関する情報。買い手がクレジットカードやデビットカードなどの支払いカードを使用することを選択した場合にのみ使用。,詳細については、EIPA_SDC_Payment検討.pptx を参照。,,,,,/Invoice/cac:PaymentMeans/cac:CardAccount,CardAccountType,,0..1,
Billing,BBIE,1,ibt-087,Payment card primary account number,The Primary Account Number (PAN) of the card used for payment.,Text,,Payment Card Information,,Primary account number,,Text,,,1..1,,支払カード番号,支払に使用するカードの支払カード番号。,カード支払セキュリティ基準に従って、請求書にはカードの主要口座番号を完全に含めない。現時点では、PCI Security Standards Council は、最初の6桁と最後の4桁が表示される最大桁数であると定義。,,,Shared,,/Invoice/cac:PaymentMeans/cac:CardAccount/cbc:PrimaryAccountNumberID,IdentifierType,,1..1,
Billing,BBIE,2,ibt-088,Payment card holder name,The name of the payment card holder. ,Text,,Payment Card Information,,Card holder name,,Text,,,0..1,,カード名義人氏名,支払カード所有者の氏名。,,,,Shared,,/Invoice/cac:PaymentMeans/cac:CardAccount/cbc:HolderName,NameType,,0..1,
Billing,ASBIE,7,ibg-19,DIRECT DEBIT,A group of business terms to specify a direct debit.,,,Payment Instructions,,Defined,,,,Direct Debit,0..1,"For further details, see EIPA_SDC_Payment検討.pptx.",自動口座引落,口座引落しを指定するビジネス条件の情報。,SEPA又は他の口座振替制度の規則に従い、SEPA又は売り手が開始する他の口座振替により支払いが行われる旨を請求書に事前通知するために使用する。詳細については、EIPA_SDC_Payment検討.pptx を参照。,,,,,/Invoice/cac:PaymentMeans/cac:PaymentMandate,PaymentMandateType,,0..1,
Billing,ABIE,0,ibg-19,DIRECT DEBIT,A group of business terms to specify a direct debit.,,,Direct Debit,,Detail,,,,,0..1,"For further details, see EIPA_SDC_Payment検討.pptx.",自動口座引落,口座引落しを指定するビジネス条件の情報。,SEPA又は他の口座振替制度の規則に従い、SEPA又は売り手が開始する他の口座振替により支払いが行われる旨を請求書に事前通知するために使用する。詳細については、EIPA_SDC_Payment検討.pptx を参照。,,,,,/Invoice/cac:PaymentMeans/cac:PaymentMandate,PaymentMandateType,,0..1,
